title,VIN,Mileage,Color,Asking Price,Car Blurb,Car Detail Page,Window Sticker,Date
Used 2015 Nissan LEAF 4dr HB S,1N4AZ0CP8FC333823,"7,355",Glacier White,"$11,991","**ACCIDENT FREE CARFAX**, **DEALER MAINTAINED**, and **LOCAL TRADE IN ONE OWNER**. Charge Package, Leaf S W/ Quick Charge Package, ABS brakes, Electronic Stability Control, Heated door mirrors, Heated Front Bucket Seats, Heated front seats, Heated rear seats, Illuminated entry, Low tire pressure warning, Remote keyless entry, and Traction control. Put down the mouse because this 2015 Nissan Leaf is the car you've been looking for. It is nicely equipped with features such as Charge Package, **ACCIDENT FREE CARFAX**, **DEALER MAINTAINED**, **LOCAL TRADE IN ONE OWNER**, ABS brakes, Electronic Stability Control, Heated door mirrors, Heated Front Bucket Seats, Heated front seats, ",http://www.bellevuenissan.com/bellevue-used-cars/detail/Used-2015-Nissan-LEAF-4dr-HB-S/1027/1N4AZ0CP8FC333823,http://cpo.nissanusa.com/nna/?1N4AZ0CP8FC333823,2017-07-11 19:57:10.030259
Used 2015 Nissan LEAF 4dr HB S,1N4AZ0CP1FC320444,"33,675",Brilliant Silver,"$11,991","NISSAN CERTIFIED **CLEAN CARFAX**, **DEALER MAINTAINED**, and **LOCAL TRADE IN ONE OWNER**. Charge Package, Leaf S W/ Quick Chage, Nissan Certified, and Brilliant Silver. Looking for a great deal on an outstanding-looking and fun 2015 Nissan Leaf? Well, we've got it. Nissan Certified Pre-Owned means you not only get the reassurance of up to a 7yr/100,000 mile Warranty, but also a 167-point comprehensive inspection, 24/7 roadside assistance, trip-interruption services, and a complete CARFAX vehicle history report. Runs and drives like new. You will not be disappointed when you see this car. It is nicely equipped with features such as Charge ",http://www.bellevuenissan.com/bellevue-used-cars/detail/Used-2015-Nissan-LEAF-4dr-HB-S/1027/1N4AZ0CP1FC320444,http://cpo.nissanusa.com/nna/?1N4AZ0CP1FC320444,2017-07-11 19:57:10.051052
2015 Nissan LEAF 4dr HB S,1N4AZ0CP9FC303181,"27,046",Cayenne Red,"$11,391","**CLEAN CARFAX**, **DEALER MAINTAINED**, and **ONE OWNER**. QUICK CHARGE Package, 4D Hatchback, and Cayenne Red. Previous owner purchased it brand new! Want to save some money? Get the NEW look for the used price on this one owner vehicle. It is nicely equipped with features such as Charge Package, **ACCIDENT FREE CARFAX**, **DEALER MAINTAINED**, **LOCAL TRADE IN ONE OWNER**, 4D Hatchback, and Cayenne Red. Nissan has established itself as a name associated with quality. This Nissan Leaf will get you where you need to go for many years to come. ",http://www.bellevuenissan.com/bellevue-used-cars/detail/2015-Nissan-LEAF-4dr-HB-S/1027/1N4AZ0CP9FC303181,http://cpo.nissanusa.com/nna/?1N4AZ0CP9FC303181,2017-07-11 19:57:10.072294
Used 2015 Nissan LEAF SV,1N4AZ0CP2FC309341,"29,773",Super Black,"$12,091","NISSAN CERTIFIED! 2015 SV WITH NAVIGATION! **CLEAN CARFAX**, **DEALER MAINTAINED**, and **ONE OWNER OFF LEASE VEHICLE**. Nissan Certified, 4D Hatchback, Super Black, ABS brakes, Electronic Stability Control, Heated door mirrors, Heated Front Bucket Seats, Heated front seats, Heated rear seats, Illuminated entry, Low tire pressure warning, Navigation System, Remote keyless entry, and Traction control. Set down the mouse because this good-looking and fun 2015 Nissan Leaf is the one-owner car you've been yearning to get your hands on. This is one great ride in superb condition. You just have to come see it to believe it. Nissan Certified Pre-Owned means ",http://www.bellevuenissan.com/bellevue-used-cars/detail/Used-2015-Nissan-LEAF-SV/1027/1N4AZ0CP2FC309341,http://cpo.nissanusa.com/nna/?1N4AZ0CP2FC309341,2017-07-11 19:57:10.092398
Used 2015 Nissan LEAF SV,1N4AZ0CP3FC301538,"27,120",Super Black,"$12,991","NISSAN CERTIFIED **CLEAN CARFAX**, **DEALER MAINTAINED**, and **ONE OWNER**. LED & QUICK CHARGE Package (Automatic On/Off Headlights, Fog Lights, and LED Low Beam Headlights), Leaf SV W/ LED Quick Charge, Nissan Certified, Super Black, ABS brakes, Electronic Stability Control, Heated door mirrors, Heated Front Bucket Seats, Heated front seats, Heated rear seats, Illuminated entry, Low tire pressure warning, Navigation System, Remote keyless entry, and Traction control. Who could say no to a simply great car like this wonderful-looking 2015 Nissan Leaf? This Leaf is nicely equipped with features such as LED & Quick Charge Package (Automatic On/Off Headlights, Fog Lights, ",http://www.bellevuenissan.com/bellevue-used-cars/detail/Used-2015-Nissan-LEAF-SV/1027/1N4AZ0CP3FC301538,http://cpo.nissanusa.com/nna/?1N4AZ0CP3FC301538,2017-07-11 19:57:10.113376
Used 2014 Nissan LEAF 4dr HB SL,1N4AZ0CP2EC337414,"33,779",Brilliant Silver,"$12,991","NISSAN CERTIFIED **CLEAN CARFAX**, **DEALER MAINTAINED**, and **ONE OWNER**. Leaf SL, Nissan Certified, ABS brakes, Electronic Stability Control, Heated door mirrors, HEATED Front Bucket Seats, Heated front seats, Heated rear seats, Illuminated entry, Low tire pressure warning, Navigation System, Remote keyless entry, and Traction control. Put down the mouse because this 2014 Nissan Leaf is the car you've been looking to get your hands on. Nissan Certified Pre-Owned means you not only get the reassurance of up to a 7yr/100,000 mile Warranty, but also a 167-point comprehensive inspection, 24/7 roadside assistance, trip-interruption services, and a complete CARFAX vehicle history report. ",http://www.bellevuenissan.com/bellevue-used-cars/detail/Used-2014-Nissan-LEAF-4dr-HB-SL/1027/1N4AZ0CP2EC337414,http://cpo.nissanusa.com/nna/?1N4AZ0CP2EC337414,2017-07-11 19:57:10.136462
Used 2014 Nissan LEAF 4dr HB SL,1N4AZ0CP2EC337090,"35,145",Cayenne Red,"$12,991","NISSAN CERTIFIED WITH NEW TIRES AND 30K SERVICE COMPELTED! **CLEAN CARFAX**, **DEALER MAINTAINED**, **ONE OWNER**, and **LEATHER INTERIOR**. Leaf SL W/ PREMIUM PACKAGE, Nissan Certified, Cayenne Red, Black w/Leather-Appointed Seat Trim, ABS brakes, Around View Monitor, Bose 7 Speaker Audio System, Electronic Stability Control, Heated door mirrors, Heated Front Bucket Seats, Heated front seats, Heated rear seats, Illuminated entry, Low tire pressure warning, Navigation System, Premium Package, Remote keyless entry, and Traction control. Tired of the same tedious drive? Well change up things with this superb 2014 Nissan Leaf. This car is nicely equipped with features such as **ACCIDENT FREE ",http://www.bellevuenissan.com/bellevue-used-cars/detail/Used-2014-Nissan-LEAF-4dr-HB-SL/1027/1N4AZ0CP2EC337090,http://cpo.nissanusa.com/nna/?1N4AZ0CP2EC337090,2017-07-11 19:57:10.157752
Used 2015 Nissan LEAF SV,1N4AZ0CP1FC323781,"34,090",Cayenne Red,"$12,997","NISSAN CERTIFIED NEW TIRES!!! **CLEAN CARFAX**, **DEALER MAINTAINED**, and **ONE OWNER**. LED & Quick Charge Package (Automatic On/Off Headlights, Fog Lights, and LED Low Beam Headlights), Leaf SV W/ LED Quick Charge, Nissan Certified, 4D Hatchback, Cayenne Red, ABS brakes, Electronic Stability Control, Heated door mirrors, Heated Front Bucket Seats, Heated front seats, Heated rear seats, Illuminated entry, Low tire pressure warning, Navigation System, Remote keyless entry, Splash Guards, and Traction control. When was the last time you smiled as you turned the ignition key? Feel it again with this gorgeous-looking 2015 Nissan Leaf. Cute Vehicle need a good home. ",http://www.bellevuenissan.com/bellevue-used-cars/detail/Used-2015-Nissan-LEAF-SV/1027/1N4AZ0CP1FC323781,http://cpo.nissanusa.com/nna/?1N4AZ0CP1FC323781,2017-07-11 19:57:10.177891
Used 2015 Nissan LEAF 4dr HB SL,1N4AZ0CP3FC304360,"31,145",Brilliant Silver,"$13,491","**ACCIDENT FREE CARFAX**, **DEALER MAINTAINED**, **LOCAL TRADE IN ONE OWNER**, and **LEATHER INTERIOR**. Leaf SL W/ PREMIUM PACKAGE, 4D Hatchback, Brilliant Silver, ABS brakes, Around View Monitor, Bose 7 Speaker Audio System, Electronic Stability Control, Heated door mirrors, Heated Front Bucket Seats, Heated front seats, Heated rear seats, Illuminated entry, Low tire pressure warning, Navigation System, Premium Package, Remote keyless entry, and Traction control. Set down the mouse because this beautiful 2015 Nissan Leaf is the high reliability car you've been longing to get your hands on. This Leaf is nicely equipped with features such as **ACCIDENT FREE CARFAX**, **DEALER ",http://www.bellevuenissan.com/bellevue-used-cars/detail/Used-2015-Nissan-LEAF-4dr-HB-SL/1027/1N4AZ0CP3FC304360,http://cpo.nissanusa.com/nna/?1N4AZ0CP3FC304360,2017-07-11 19:57:10.198200
Used 2015 Nissan LEAF,1N4AZ0CP1FC305894,"12,473",Brilliant Silver,"$13,691","NISSAN CERTIFIED **CLEAN CARFAX**, **DEALER MAINTAINED**, and **ONE OWNER**. Charge Package, Leaf S W/ QUICK CHARGE, Nissan Certified, 4D Hatchback, and Brilliant Silver. Put down the mouse because this 2015 Nissan Leaf is the car you've been looking to get your hands on. Nissan Certified Pre-Owned means you not only get the reassurance of up to a 7yr/100,000 mile Warranty, but also a 167-point comprehensive inspection, 24/7 roadside assistance, trip-interruption services, and a complete CARFAX vehicle history report. This Leaf is nicely equipped with features such as Charge Package, **ACCIDENT FREE CARFAX**, **DEALER MAINTAINED**, **LOCAL TRADE IN ONE OWNER**, 4D ",http://www.bellevuenissan.com/bellevue-used-cars/detail/Used-2015-Nissan-LEAF/1027/1N4AZ0CP1FC305894,http://cpo.nissanusa.com/nna/?1N4AZ0CP1FC305894,2017-07-11 19:57:10.217471
2014 Nissan LEAF,1N4AZ0CP0EC337735,"25,552",Black,"$13,491","Your satisfaction is our business! The Bellevue Nissan EDGE! This handsome 2014 Nissan Leaf is the rare family vehicle you have been trying to find. This wonderful Nissan Leaf is just waiting to bring the right owner lots of joy and happiness with years of trouble-free use.**PRICE INCLUDES $750 REBATE, MUST FINANCE AT STANDARD RATES WITH NMAC** ",http://www.bellevuenissan.com/bellevue-used-cars/detail/2014-Nissan-LEAF/1027/1N4AZ0CP0EC337735,http://cpo.nissanusa.com/nna/?1N4AZ0CP0EC337735,2017-07-11 19:57:10.241595
Used 2016 Nissan LEAF S,1N4BZ0CPXGC313191,"2,117",Brilliant Silver,None,"NISSAN CERTIFIED **CLEAN CARFAX**, **DEALER MAINTAINED**, and **LOCAL TRADE IN ONE OWNER**. Charger Package, Nissan Certified, 4D Hatchback, and Splash Guards. Wow! What a nice smaller car. This good-looking and fun 2016 Nissan Leaf has a great ride and great power. I really enjoyed driving it. It's very clean, almost new, and really fun to drive. Nissan Certified Pre-Owned means you not only get the reassurance of up to a 7yr/100,000 mile Warranty, but also a 167-point comprehensive inspection, 24/7 roadside assistance, trip-interruption services, and a complete CARFAX vehicle history report. This Leaf has only been gently used and has ",http://www.bellevuenissan.com/bellevue-used-cars/detail/Used-2016-Nissan-LEAF-S/1027/1N4BZ0CPXGC313191,http://cpo.nissanusa.com/nna/?1N4BZ0CPXGC313191,2017-07-11 19:57:10.261933
Used 2016 Nissan LEAF S,1N4AZ0CP2GC305212,"2,000",Pearl White,"$13,991","NISSAN CERTIFIED **CLEAN CARFAX**, **DEALER MAINTAINED**, and **ONE OWNER**. Charger Package, Leaf S W/ Quick Charge, Nissan Certified, and Pearl White. If you demand the best things in life, this great 2016 Nissan Leaf is the one-owner car for you. It is nicely equipped with features such as Charger Package, **ACCIDENT FREE CARFAX**, **DEALER MAINTAINED**, **LOCAL TRADE IN ONE OWNER**, Leaf S W/ Quick Charge, Nissan Certified, and Pearl White. Nissan Certified Pre-Owned means you not only get the reassurance of up to a 7yr/100,000 mile Warranty, but also a 167-point comprehensive inspection, 24/7 roadside assistance, trip-interruption services, and a ",http://www.bellevuenissan.com/bellevue-used-cars/detail/Used-2016-Nissan-LEAF-S/1027/1N4AZ0CP2GC305212,http://cpo.nissanusa.com/nna/?1N4AZ0CP2GC305212,2017-07-11 19:57:10.284017
Used 2016 Nissan LEAF S,1N4AZ0CP4GC309956,"1,268",Brilliant Silver,"$13,991","NISSAN CERTIFIED **CLEAN CARFAX**, **DEALER MAINTAINED**, and **ONE OWNER**. Charger Package, Leaf S W/ QUICK CHARGE Package, Nissan Certified, Brilliant Silver, ABS brakes, Electronic Stability Control, Heated Front Bucket Seats, HEATED front seats, Illuminated entry, Low tire pressure warning, Remote keyless entry, and Traction control. Want to stretch your purchasing power? Well take a look at this terrific 2016 Nissan Leaf. Nissan Certified Pre-Owned means you not only get the reassurance of up to a 7yr/100,000 mile Warranty, but also a 167-point comprehensive inspection, 24/7 roadside assistance, trip-interruption services, and a complete CARFAX vehicle history report. Cute Vehicle need a ",http://www.bellevuenissan.com/bellevue-used-cars/detail/Used-2016-Nissan-LEAF-S/1027/1N4AZ0CP4GC309956,http://cpo.nissanusa.com/nna/?1N4AZ0CP4GC309956,2017-07-11 19:57:10.304105
Used 2016 Nissan LEAF S,1N4AZ0CPXGC311291,"1,697",Glacier White,"$13,991","NISSAN CERTIFIED **CLEAN CARFAX**, **DEALER MAINTAINED**, and **ONE OWNER**. Charger Package, Leaf S W/ Quick Charge Package, Nissan Certified, 4D Hatchback, Glacier White, ABS brakes, Electronic Stability Control, Heated Front Bucket Seats, HEATED front seats, Illuminated entry, Low tire pressure warning, Remote keyless entry, and Traction control. Confused about which vehicle to buy? Well look no further than this great 2016 Nissan Leaf. This car is nicely equipped with features such as Charger Package, **ACCIDENT FREE CARFAX**, **DEALER MAINTAINED**, **LOCAL TRADE IN ONE OWNER**, 4D Hatchback, ABS brakes, Electronic Stability Control, Glacier White, Heated Front Bucket Seats, Heated front seats, ",http://www.bellevuenissan.com/bellevue-used-cars/detail/Used-2016-Nissan-LEAF-S/1027/1N4AZ0CPXGC311291,http://cpo.nissanusa.com/nna/?1N4AZ0CPXGC311291,2017-07-11 19:57:10.323313
2015 Nissan LEAF,1N4AZ0CP8FC315970,"19,830",Gray,"$13,297","Come to Bellevue Nissan! You NEED to see this car! Wow! What a nice smaller car. This beautiful 2015 Nissan Leaf has a great ride and great power. I really enjoyed driving it. It's very clean, almost new, and really fun to drive. This Leaf simply exudes luxury as you settle yourself in behind the wheel. Feels great, doesn't it? Oh, yes, life IS good. ",http://www.bellevuenissan.com/bellevue-used-cars/detail/2015-Nissan-LEAF/1027/1N4AZ0CP8FC315970,http://cpo.nissanusa.com/nna/?1N4AZ0CP8FC315970,2017-07-11 19:57:10.345324
